CREATE TABLE `t` (`id` int(11) NOT NULL, `f` varchar(100) DEFAULT NULL, PRIMARY KEY (`id`)) ENGINE=InnoDB;
insert into t values(12345, 'value1'), (54321, 'value2');
begin;
select * from t;
id	f
12345	value1
54321	value2
begin;
update t set f='foo' where id=12345;
commit;
select * from t;
id	f
12345	foo
54321	value2
drop table if exists t;
